{
  "schemaVersion": "msig.report.v0.3",
  "version": "0.3.0",
  "title": "Minimal mSigSDK Report",
  "summary": "Smallest valid report fixture for schema validation.",
  "generatedAt": "2026-06-24T00:00:00.000Z",
  "parameters": {},
  "primaryInterpretationFields": [],
  "reproducibilityStatement": "This minimal fixture records only the required report envelope.",
  "reproducibility": {
    "schemaVersion": "msig.reproducibility.v0.1",
    "claim": "portable_schema_validated_analysis_record",
    "auditability": { "status": "supported" },
    "portability": { "status": "supported" },
    "computationalReproducibility": {
      "status": "not_established",
      "missingRequirements": ["immutable_execution_artifacts"]
    },
    "requirements": [
      "sdkArtifact",
      "adapterImplementations",
      "runtimeAndPackageArtifacts",
      "lockfilesOrArtifactHashes",
      "localInputHashes",
      "signatureCatalogPayload",
      "contextOrder",
      "analysisParameters",
      "randomNumberGeneration",
      "reportSchema",
      "executionEnvironment",
      "archivedTestData",
      "rerunScripts"
    ],
    "evidence": {
      "sdkArtifact": null,
      "adapterImplementations": null,
      "runtimeAndPackageArtifacts": null,
      "lockfilesOrArtifactHashes": null,
      "localInputHashes": null,
      "signatureCatalogPayload": null,
      "contextOrder": null,
      "analysisParameters": null,
      "randomNumberGeneration": null,
      "reportSchema": null,
      "executionEnvironment": null,
      "archivedTestData": null,
      "rerunScripts": null
    },
    "notes": []
  },
  "citations": [],
  "notes": []
}
