{
  "schemaVersion": "msig.report.v0.3",
  "version": "0.3.0",
  "title": "Full mSigSDK Report Fixture",
  "summary": "Representative report fixture with validation, QC, exposure, extraction, and provenance fields.",
  "generatedAt": "2026-06-24T00:00:00.000Z",
  "workflowRole": "signature_fitting_and_extraction",
  "scopeStatement": "Fixture values are illustrative schema-validation records, not biological results.",
  "methodBasis": {
    "method": "native_js_nnls_nmf",
    "references": [
      {
        "key": "FixtureReference",
        "citation": "Representative fixture citation.",
        "url": "https://episphere.github.io/msig/"
      }
    ]
  },
  "primaryInterpretationFields": [
    "validation.valid",
    "qc.reconstruction.samples[0].cosineSimilarity",
    "extraction.rank"
  ],
  "reproducibilityStatement": "Fixture generated for schema validation; no external data were used.",
  "reproducibility": {
    "schemaVersion": "msig.reproducibility.v0.1",
    "claim": "portable_schema_validated_analysis_record",
    "auditability": { "status": "supported" },
    "portability": { "status": "supported" },
    "computationalReproducibility": {
      "status": "not_established",
      "missingRequirements": ["immutable_execution_artifacts"]
    },
    "requirements": [
      "sdkArtifact",
      "adapterImplementations",
      "runtimeAndPackageArtifacts",
      "lockfilesOrArtifactHashes",
      "localInputHashes",
      "signatureCatalogPayload",
      "contextOrder",
      "analysisParameters",
      "randomNumberGeneration",
      "reportSchema",
      "executionEnvironment",
      "archivedTestData",
      "rerunScripts"
    ],
    "evidence": {
      "sdkArtifact": null,
      "adapterImplementations": null,
      "runtimeAndPackageArtifacts": null,
      "lockfilesOrArtifactHashes": null,
      "localInputHashes": null,
      "signatureCatalogPayload": null,
      "contextOrder": null,
      "analysisParameters": null,
      "randomNumberGeneration": null,
      "reportSchema": null,
      "executionEnvironment": null,
      "archivedTestData": null,
      "rerunScripts": null
    },
    "notes": ["The fixture intentionally does not claim computational rerun support."]
  },
  "parameters": {
    "profile": "SBS",
    "matrix": 96,
    "exposureType": "relative",
    "strictLocal": true,
    "seed": 17
  },
  "validation": {
    "valid": true,
    "issues": [],
    "warnings": []
  },
  "qc": {
    "mutationBurden": {
      "sampleCount": 1
    },
    "reconstruction": {
      "samples": [
        {
          "sample": "FixtureSample",
          "cosineSimilarity": 1,
          "rmse": 0
        }
      ]
    }
  },
  "signatures": {
    "type": "object",
    "keys": 2
  },
  "exposures": {
    "type": "object",
    "keys": 1
  },
  "extraction": {
    "rank": 1,
    "reconstructionError": 0,
    "converged": true
  },
  "provenance": {
    "sdkVersion": "0.3.0",
    "runtime": "node"
  },
  "citations": [
    {
      "key": "FixtureReference",
      "citation": "Representative fixture citation.",
      "url": "https://episphere.github.io/msig/"
    }
  ],
  "notes": [
    "Intentional schema-validation fixture."
  ]
}
